"Clinic Name","Doctor Name","City","Specialty","Instagram Handle","Phone Number","WhatsApp Number","Website","Google Rating","Review Count","Pain Signal","ICP Score"
"SameDay Dental Clinic","Dr. Costa Nicolopoulos","Dubai","Implant / ZAGA Center","@samedayimplants","+971 4 3156000","","https://www.samedayme.com/","4.8","285","Specialized implant focus - patients expect high-precision appointment coordination.","3"
"Dr. Thomas Dental Implant Clinic","Dr. Thomas","Dubai","Implant","","+971 4 4431718","+971567595137","https://drthomasdentalimplantclinic.com/","4.9","200","Direct WhatsApp listed - high potential for automated missed-call fallback integration.","3"
"NOA Dental Clinic","","Dubai","Cosmetic / Veneers","@noadentalclinic","+971 4 3944444","+971563211745","https://noadentalclinic.com/","4.8","400","Multi-award winning - premium reputation requires 24/7 responsive booking.","3"
"APA Aesthetic Dental Center","","Dubai","Boutique Cosmetic","@apa.aesthetic","+971 4 321 0000","","https://apaaesthetic.ae/","4.9","150","High-end boutique styling - patient experience starts with the first phone call.","3"
"Le Dente Dental Clinic","Dr. Rashida Juzar Ali","Dubai","Cosmetic / Digital Smile Design","@ledentedental","+971 4 394 4444","","https://ledente.com/","4.8","100","Personalized care focus - doctor's reputation linked to clinic responsiveness.","3"
"Aesthete Dental Clinic","","Dubai","Premium Veneers","@aesthet.ae","+971 4 343 3310","","https://aesthet.ae/","4.9","80","Ultra-premium positioning - missed calls are lost high-ticket revenue.","3"
"Dr. Michael's Dental Clinic","","Dubai","Cosmetic / Implant","@drmichaelsdental","+971 4 3949433","","https://www.drmichaels.com/","4.7","500","Legacy clinic with massive volume - primary candidate for call recovery automation.","3"
"Dr. Joy Dental Clinic","","Dubai","Multi-specialty / Cosmetic","@drjoydentalclinic","+971 4 397 9522","","https://www.drjoydentalclinic.com/","4.6","450","Large multi-branch operation - difficult to maintain phone response across all locations.","3"
"Magnum Clinic Dubai","","Dubai","Cosmetic / General","@magnumclinic","+971 4 388 3886","","https://magnumclinic.ae/","4.8","200","Modern clinic focus - patients are digitally native and prefer WhatsApp.","3"
"Micris Dental Clinic","","Dubai","Premium Multi-specialty","@micrisdental","+971 4 330 0441","","https://micrisdentalclinic.com/","4.8","300","One of Dubai's largest providers - high traffic environment creates response delays.","3"
"Sky Clinic Dental Center","","Dubai","Aesthetic","@skyclinicdubai","+971 4 3633283","","https://skyclinic.com","4.9","120","International specialist team - requires high-quality bilingual lead management.","3"
"Esthetic Dubai (La Maison Des Sourires)","","Dubai","Cosmetic","@esthetic.dubai.uae","+971 4 239 8848","","https://estheticdubai.com","4.9","342","High volume; potential for missed night/weekend inquiries.","3"
"Dentist Direct Dubai","Dr. Zul Paliwalla","Dubai","Digital Dentistry","@dentistdirect_dubai","+971 4 455 8500","","https://dentistdirect.ae","4.8","373","24/7 Emergency listed - heavy triage needs suitable for AI automation.","3"
"The Perio Clinic","Dr. Geoffrey Sharpe","Dubai","Periodontics/Surgical","@theperioclinic","+971 4 442 8515","","https://perio.ae","5.0","158","Strict surgical focus - needs high quality lead pre-screening.","3"
"Sejovi Dental & Implant Center","Dr. Sejo Isaac","Dubai","Implant","@sejovi_dental","+971 50 281 6170","","https://sejovi.com","4.9","387","Mobile contact listed - clinic likely uses manual WhatsApp for leads.","3"
"New Ivory Dental & Implant Clinic","Dr. Tanveer Ahmed","Dubai","Implant","@new.ivory.dental","+971 4 349 3313","","https://newivory.com","5.0","331","CRITICAL: Website unreachable; clinic losing massive digital lead volume.","3"
"Digital Implant Clinic","","Dubai","Implant","@digitalimplantclinic","+971 50 675 3166","","https://digitalimplantclinic.ae","4.9","101","CRITICAL: Website unreachable; clinic depends entirely on manual social/maps response.","3"
"Dental Implantologist UAE","Dr. Gunjan Alad","Dubai","Implant","@drgunjan_alad","+971 58 521 7979","","https://dentalimplantologistuae.com","5.0","125","CRITICAL: Website unreachable; doctor likely loses direct implant inquiries.","3"
"Dentzz Dental Care Centre","Dr. Shantanu Jambhekar","Dubai","Premium Cosmetic","@dentzz_dental","+971 4 452 1444","","https://dentzz.ae","5.0","444","High international lead volume; human response bottleneck.","3"
"The TopDent","Dr. Divakar","Dubai","Cosmetic","@topdentdubai","+971 50 144 0432","","https://topdent.ae","5.0","260","CRITICAL: Website suspended; urgent need for automated response backup.","3"
"Dr Krish Esthetik Studio","Dr. Krish","Dubai","Aesthetics","@dr_krish_esthetik","+971 50 837 3481","","https://drkrishesthetik.com","4.8","276","CRITICAL: Website unreachable; potential lost aesthetic patient leads.","3"
